{
  "$schema": "../schema/spec-object.schema.json",
  "schema_version": 1,
  "kind": "story",
  "id": "ATC-AI-001",
  "version": "1.0.0",
  "status": "approved",
  "target_release": "REL-R1-RECEIVING-PILOT@1.0.0",
  "epic_id": "EP-AI-GOVERNANCE",
  "feature_id": "FEAT-AI-DOC-EXTRACTION",
  "title": "实施 DEV-016 AI 资料抽取与缺口建议契约切片",
  "summary": "按 AI-BOM-014 前置条件（OD-006/007 未决）把 AI 收敛为治理契约层：运行控制封套、事实类别不得提升、抽取候选/缺口建议/人工处置契约与纯失败关闭校验、序列化冻结；不运行模型、不处理客户数据、不注册任何运行时能力。",
  "owners": ["技术负责人", "AI负责人", "质量负责人", "QA负责人"],
  "source_refs": [
    {"document": "PRD-MAIN", "item": "AI-BOM-002"},
    {"document": "PRD-MAIN", "item": "AI-BOM-004"},
    {"document": "PRD-MAIN", "item": "AI-BOM-007"},
    {"document": "PRD-MAIN", "item": "AI-BOM-008"},
    {"document": "PRD-MAIN", "item": "AI-BOM-009"},
    {"document": "PRD-MAIN", "item": "AI-BOM-010"},
    {"document": "PRD-MAIN", "item": "AC-AI-003"}
  ],
  "depends_on": ["ED-001@2.0.0", "OD-002@1.0.0", "BUS-AI-001@1.0.0", "BUS-AI-002@1.0.0", "BUS-AI-003@1.0.0", "AC-AI-003@1.0.0", "NFR-ARCH-001@2.0.0"],
  "affects": ["ai", "run-control", "fact-class", "extraction", "gap-suggestion", "human-review", "contracts", "serialization", "automated-test"],
  "change_class": "major",
  "body": {
    "readiness": "ready",
    "implementation_task_id": "DEV-016",
    "approval_evidence": "用户于 2026-07-26 明确选择'AI 降级为契约切片'：因 AI-BOM-014 把 OD-006（数据分类/处理区域/模型许可）与 OD-007（品类/复核阈值/停止条件）设为运行前置且两者均未决，本卡仅交付治理契约与纯校验，不运行模型、不触碰 OD-006/007。",
    "business_outcome": "AI 旁路在获得法务/隐私批准前即拥有被冻结的治理契约：运行封套、事实类别税则、失败关闭校验和人工处置结构可被未来生产化直接复用，且任何消费方都无法绕过'近似、非约束、未验证'的治理边界。",
    "actor": "平台与 AI 治理契约维护者（无运行时操作者——本卡不交付任何运行时能力）",
    "preconditions": ["OD-006/OD-007 保持 open，本卡不改变其状态", "架构测试已允许 contracts/<module> 公共契约根"],
    "trigger": "契约维护者为 AI 旁路定义或演进治理契约",
    "happy_path": ["定义运行控制封套（模型/路由/提示模板/输出模式/输入版本全固定）", "以纯规则校验模型结构化输出：合法输出产出候选（含来源定位与事实类别）与缺口/澄清建议", "未知字段、非法单位或缺必需来源→整体 QUARANTINED 并列明验证错误", "校验 VERIFIED_FACT 必须同时携带权威来源与验证方法，AI_INFERENCE 提升被拒绝", "人工处置（ACCEPT/MODIFY/SPLIT/MERGE/REJECT）保留 AI 原值、人工值、原因、责任人且类别不变", "契约测试固定 JSON 字段与形状"],
    "failure_paths": ["封套缺任一固定引用即校验失败", "未知事实类别或处置类型即校验失败", "无权威来源+验证方法的 VERIFIED_FACT 或类别提升返回 AIX.FACT_CLASS_PROMOTION_REJECTED", "非法输出隔离并返回 AIX.OUTPUT_QUARANTINED 明细", "MODIFY 缺人工值/原因/责任人即校验失败", "本卡无运行时失败路径——无 HTTP、无持久化、无模型调用"],
    "invariants": ["事实类别与处置类型为显式最小枚举", "AI_INFERENCE 永不自动成为 VERIFIED_FACT（AC-AI-002）", "隔离输出不产生任何下游产物（AC-AI-003）", "处置保留 AI 原值且不改类别", "规则为纯函数且确定性", "本卡不注册模块、schema、HTTP 端点、能力或模型调用", "不修改 OD-006/OD-007 及任何既有规格"],
    "data_contract": {"runEnvelope": ["modelRef/version", "gatewayRoute", "promptTemplateRef/version", "outputSchemaRef/version", "inputRefs[](ref/version)"], "candidate": ["candidateId", "targetField", "value", "unit?", "factClass(OBSERVATION/ASSUMPTION/AI_INFERENCE/VERIFIED_FACT)", "confidence(0..1)", "sourceLocation{documentRef/version, page?, region?}", "authoritySourceRef?/version", "verificationMethodRef?/version"], "gapSuggestion": ["gapId", "targetField", "kind(MISSING_INFORMATION/CLARIFICATION)", "question"], "validationResult": ["decision(ACCEPTED/QUARANTINED)", "errors(field, code, detail)", "candidates[]", "gaps[]"], "disposition": ["dispositionId", "candidateId", "kind(ACCEPT/MODIFY/SPLIT/MERGE/REJECT)", "aiOriginalValue", "humanValue?", "reason", "responsibleActor"]},
    "api_contract": {"operations": [], "publicPort": "无——本卡只交付 OpenLIMS.Contracts.Ai 纯契约程序集与 IAiOutputValidator 纯规则接口，不注册任何 HTTP 端点或运行时端口", "errors": ["AIX.VALIDATION_FAILED", "AIX.OUTPUT_QUARANTINED", "AIX.FACT_CLASS_PROMOTION_REJECTED"]},
    "state_transitions": ["无运行时状态机——校验为纯函数，输入到结果单向且确定"],
    "permissions": ["本卡不新增能力、claim 或授权面", "契约程序集无外部依赖且不接触部署配置或模型凭据"],
    "audit": ["本卡无运行时审计面；契约演进由规格版本与生成锁追溯"],
    "observability": ["本卡无运行时指标；契约回归由 Profile=ai 测试在 CI 固定"],
    "ui_states": ["本卡不新增前端页面", "无任何客户端交互面——契约消费者为未来的 AI 旁路模块"],
    "test_cases": [
      {"id": "TC-AI-001-01", "title": "封套完整性", "type": "positive", "given": ["全固定引用的封套"], "when": ["校验"], "then": ["通过", "缺任一引用即失败"]},
      {"id": "TC-AI-001-02", "title": "AC-AI-003 失败关闭", "type": "negative", "given": ["含未知字段、非法单位或缺来源的输出"], "when": ["校验"], "then": ["整体 QUARANTINED", "错误明细列出字段与代码", "无下游产物"]},
      {"id": "TC-AI-001-03", "title": "AC-AI-002 类别不得提升", "type": "negative", "given": ["AI_INFERENCE 候选无权威来源或验证方法"], "when": ["声明 VERIFIED_FACT 或提升"], "then": ["AIX.FACT_CLASS_PROMOTION_REJECTED"]},
      {"id": "TC-AI-001-04", "title": "不确定性表达", "type": "boundary", "given": ["同一字段多候选分支与弃权"], "when": ["校验"], "then": ["分支与弃权合法", "伪装单一确定答案的重复字段拒绝"]},
      {"id": "TC-AI-001-05", "title": "处置原值保留", "type": "regression", "given": ["MODIFY 处置"], "when": ["校验"], "then": ["AI 原值、人工值、原因、责任人齐备", "缺任一即失败", "类别不变"]},
      {"id": "TC-AI-001-06", "title": "缺口建议独立", "type": "positive", "given": ["缺失信息与澄清问题"], "when": ["校验"], "then": ["建议独立于候选表达", "不写入受控对象"]},
      {"id": "TC-AI-001-07", "title": "序列化冻结", "type": "regression", "given": ["全部契约记录样例载荷"], "when": ["JSON 往返并比对形状"], "then": ["字段与结构与冻结样例一致"]},
      {"id": "TC-AI-001-08", "title": "确定性", "type": "regression", "given": ["同一输入重复校验"], "when": ["多次执行"], "then": ["结果逐字段一致", "无时钟或随机依赖"]}
    ],
    "non_goals": ["不运行任何模型或处理客户数据（OD-006/007 未决，AI-BOM-014 前置不满足）", "不实现图片近似 BOM（R1 排除产品化）", "不实现注入防御运行时、降级开关或评估集执行（后续卡）", "不新增能力或权限语义", "不修改 Release baseline，不创建 Seal、tag、GitHub Release 或部署"],
    "allowed_paths": ["spec/requirements/BUS-AI-001__v1.0.0.json", "spec/requirements/BUS-AI-002__v1.0.0.json", "spec/requirements/BUS-AI-003__v1.0.0.json", "spec/acceptance/AC-AI-003__v1.0.0.json", "spec/stories/ATC-AI-001__v1.0.0.json", "generated/spec/**", ".planning/2026-07-26-dev-016-ai-extraction/**", "OpenLIMS.slnx", "contracts/ai/**", "tests/contract/ai/**", "tests/architecture/**", "tests/test_repository_contract.py", "docs/domain/ai/**", "scripts/verify.ps1", "scripts/verify.sh"],
    "verification_commands": ["python -m tools.specgen ready --story ATC-AI-001@1.0.0", "pwsh -File scripts/verify.ps1 -Profile task -Module ai", "pwsh -File scripts/verify.ps1 -Profile architecture", "pwsh -File scripts/verify.ps1 -Profile contracts", "python -m tools.specgen check"],
    "definition_of_done": ["契约覆盖运行封套、事实类别、候选/缺口/处置全部维度", "失败关闭隔离、类别提升拒绝与原值保留通过确定性测试", "序列化字段与形状被契约测试冻结", "无任何运行时注册", "全仓验证通过且二次 generate written=0", "所有变更位于 allowed_paths"]
  }
}
