{
  "$schema": "../schema/spec-object.schema.json",
  "schema_version": 1,
  "kind": "story",
  "id": "ATC-TEX-001",
  "version": "1.0.0",
  "status": "approved",
  "target_release": "REL-R1-RECEIVING-PILOT@1.0.0",
  "epic_id": "EP-RECEIVING",
  "feature_id": "FEAT-TEXTILE-SAMPLE-REQUIREMENT",
  "title": "实施 DEV-011 纺织样品需求未来适配契约切片",
  "summary": "按 PRD 对非试点行业包的未来适配要求，交付纺织样品需求与 CuttingPlan 的领域模型、互斥裁样/样品不足纯规则和序列化契约测试；不注册模块、schema、HTTP 端点或运行时端口，不触碰未决 OD-001。",
  "owners": ["实验室技术负责人", "技术负责人", "质量负责人", "QA负责人"],
  "source_refs": [
    {"document": "PRD-MAIN", "item": "OPS-TEXTILE-001"},
    {"document": "PRD-MAIN", "item": "OPS-TEXTILE-002"},
    {"document": "PRD-MAIN", "item": "OPS-TEXTILE-003"},
    {"document": "PRD-MAIN", "item": "AC-TEXTILE-001"}
  ],
  "depends_on": ["ED-001@2.0.0", "OD-002@1.0.0", "OD-027@1.0.0", "BUS-TEX-001@1.0.0", "BUS-TEX-002@1.0.0", "BUS-TEX-003@1.0.0", "AC-TEXTILE-001@1.0.0", "NFR-ARCH-001@2.0.0"],
  "affects": ["textile", "sample-requirement", "cutting-plan", "contracts", "serialization", "automated-test"],
  "change_class": "major",
  "body": {
    "readiness": "ready",
    "implementation_task_id": "DEV-011",
    "approval_evidence": "用户于 2026-07-26 明确选择‘纺织降级为契约切片’并给出全流程授权：因 OD-001@0.1.0 记录用户拒绝纺织首发（玩具方向）且 OPS-TEXTILE-* 为行业包 Must，本卡按 PRD L1291/L1327 仅交付领域模型、规则接口与序列化契约测试，不生产化、不触碰 OD-001。",
    "business_outcome": "纺织行业包获得可版本化、可测试的契约基线：样品需求计算维度、互斥裁样与不足阻断规则、CuttingPlan 结构在纺织包正式纳入发布前即被冻结，未来生产化不需要破坏性契约变更。",
    "actor": "平台与行业包契约维护者（无运行时操作者——本卡不交付任何运行时能力）",
    "preconditions": ["OD-001 试点行业决定保持 open，本卡不改变其状态", "OD-027 已决定 ScopeLine 以 (Id, Version) 钉住 SampleRequirement", "架构测试已允许 contracts/<module> 公共契约根"],
    "trigger": "契约维护者为纺织行业包定义或演进样品需求与 CuttingPlan 契约",
    "happy_path": ["定义版本固定的需求行维度模型（款号、颜色、部件、材料、部位、方向、项目、平行数、预处理、互斥破坏组、复测预留、留样）", "以纯函数计算每行所需试样数并按款色部件部位聚合需求面积", "校验共享声明：跨互斥组或含破坏性行的共享被拒绝", "可用面积充足返回 SUFFICIENT 及试样计划，不足返回 INSUFFICIENT 及按维度聚合的缺口", "CuttingPlan 结构校验通过后可序列化冻结", "契约测试固定 JSON 字段与形状"],
    "failure_paths": ["规则集版本未知返回 UNKNOWN 决定", "方向未知或引用缺失即校验失败", "跨互斥破坏组的裁片共享声明被拒绝", "尺寸或数量非正、生成试样数与计划不一致的 CuttingPlan 校验失败", "本卡无运行时失败路径——无 HTTP、无持久化、无审计面"],
    "invariants": ["所需试样数恒等于平行数加复测预留加留样", "不得以同一裁片满足互斥破坏任务", "非破坏性同规格行允许共享（一试样多次非破坏性使用）", "缺口必须按款号、颜色、部件、部位聚合并列明方向与项目", "UNKNOWN 等同阻断", "规则为纯函数且确定性", "本卡不注册模块、schema、HTTP 端点、运行时端口或宿主接线", "不修改 OD-001/OD-025 及任何既有规格"],
    "data_contract": {"demandLine": ["style/version", "colorway/version", "component/version", "material/version", "position", "direction", "testItemRef/version", "parallelCount", "retestReserveCount", "retentionReserveCount", "preconditioningRef/version?", "exclusiveDestructiveGroupId?", "destructive", "specimenLengthMm", "specimenWidthMm", "shareGroupId?"], "availableFabric": ["style/version", "colorway/version", "component/version", "position", "availableAreaSquareMm"], "calculationResult": ["decision(SUFFICIENT/INSUFFICIENT/UNKNOWN)", "reasonCodes", "specimenPlans(requiredSpecimenCount, areaSquareMm)", "gaps(style, colorway, component, position, requiredAreaSquareMm, availableAreaSquareMm, gapAreaSquareMm, contributingItems(direction, testItemRef))", "ruleSetVersion"], "cuttingPlan": ["cuttingPlanId", "sourceItemRef/version", "samplingPosition", "direction", "lengthMm", "widthMm", "plannedCount", "minDistanceFromSelvedgeMm", "templateVersion", "operatorId", "generatedSpecimenIds"], "directions": ["WARP", "WEFT", "LENGTHWISE", "CROSSWISE"]},
    "api_contract": {"operations": [], "publicPort": "无——本卡只交付 OpenLIMS.Contracts.Textile 纯契约程序集与 ITextileSampleRequirementCalculator 纯规则接口，不注册任何 HTTP 端点或运行时端口", "errors": ["TEX.VALIDATION_FAILED", "TEX.DIRECTION_UNKNOWN", "TEX.EXCLUSIVE_SHARE_REJECTED", "TEX.APPLICABILITY_UNKNOWN"]},
    "state_transitions": ["无运行时状态机——计算为纯函数，输入到结果单向且确定"],
    "permissions": ["本卡不新增能力、claim 或授权面", "契约程序集无外部依赖且不接触部署配置"],
    "audit": ["本卡无运行时审计面；契约演进由规格版本与生成锁追溯"],
    "observability": ["本卡无运行时指标；契约回归由 Profile=textile 测试在 CI 固定"],
    "ui_states": ["本卡不新增前端页面", "无任何客户端交互面——契约消费者为未来的纺织行业包模块"],
    "test_cases": [
      {"id": "TC-TEX-001-01", "title": "试样数与面积计算", "type": "positive", "given": ["三平行加复测预留加留样的需求行"], "when": ["纯规则计算"], "then": ["所需试样数恒等于三者之和", "需求面积等于试样数乘长乘宽"]},
      {"id": "TC-TEX-001-02", "title": "AC-TEXTILE-001 不足缺口", "type": "boundary", "given": ["同一面料两个互斥破坏项目", "可用面积不足"], "when": ["计算充足性"], "then": ["INSUFFICIENT", "缺口按款色部件部位聚合并列明方向与项目"]},
      {"id": "TC-TEX-001-03", "title": "互斥共享拒绝", "type": "negative", "given": ["跨互斥破坏组的共享声明"], "when": ["计算"], "then": ["TEX.EXCLUSIVE_SHARE_REJECTED", "不产生试样计划"]},
      {"id": "TC-TEX-001-04", "title": "非破坏性共享", "type": "positive", "given": ["两条非破坏性同规格行声明共享"], "when": ["计算"], "then": ["共享组按最大需求取试样数", "不重复累加面积"]},
      {"id": "TC-TEX-001-05", "title": "未知语义失败关闭", "type": "negative", "given": ["未知规则集版本或未知方向"], "when": ["计算"], "then": ["UNKNOWN 或校验失败", "无部分结果"]},
      {"id": "TC-TEX-001-06", "title": "CuttingPlan 校验", "type": "boundary", "given": ["完整与缺失字段的 CuttingPlan"], "when": ["结构校验"], "then": ["完整计划通过", "尺寸非正、方向未知或试样数不一致失败"]},
      {"id": "TC-TEX-001-07", "title": "序列化冻结", "type": "regression", "given": ["全部契约记录的样例载荷"], "when": ["JSON 往返并比对形状"], "then": ["字段名与结构与冻结样例一致", "反序列化等值"]},
      {"id": "TC-TEX-001-08", "title": "确定性", "type": "regression", "given": ["同一输入重复计算"], "when": ["多次执行"], "then": ["结果逐字段一致", "无时钟或随机依赖"]}
    ],
    "non_goals": ["不生产化纺织行业包（无模块、无 schema、无迁移、无 HTTP、无宿主接线）", "不实现调湿/洗涤执行（OPS-TEXTILE-004 属 ATC-TEX-003）", "不实现 CoverageDecision（OPS-TEXTILE-005/OD-028）", "不改变或决定 OD-001/OD-025 试点方向", "不实现范围/补样变更工作流", "不新增能力或权限语义", "不修改 Release baseline，不创建 Seal、tag、GitHub Release 或部署"],
    "allowed_paths": ["spec/requirements/BUS-TEX-001__v1.0.0.json", "spec/requirements/BUS-TEX-002__v1.0.0.json", "spec/requirements/BUS-TEX-003__v1.0.0.json", "spec/acceptance/AC-TEXTILE-001__v1.0.0.json", "spec/stories/ATC-TEX-001__v1.0.0.json", "generated/spec/**", ".planning/2026-07-26-dev-011-textile-sample-requirement/**", "OpenLIMS.slnx", "contracts/textile/**", "tests/contract/textile/**", "tests/architecture/**", "tests/test_repository_contract.py", "docs/domain/textile/**", "scripts/verify.ps1", "scripts/verify.sh"],
    "verification_commands": ["python -m tools.specgen ready --story ATC-TEX-001@1.0.0", "pwsh -File scripts/verify.ps1 -Profile task -Module textile", "pwsh -File scripts/verify.ps1 -Profile architecture", "pwsh -File scripts/verify.ps1 -Profile contracts", "python -m tools.specgen check"],
    "definition_of_done": ["契约模型覆盖 OPS-TEXTILE-001/002/003 全部维度", "互斥共享拒绝、不足缺口聚合和 UNKNOWN 失败关闭通过确定性测试", "序列化字段与形状被契约测试冻结", "无任何运行时注册（模块、schema、端点、能力）", "架构边界测试通过且 contracts/textile 纳入公共契约扫描", "全仓验证通过且二次 generate written=0", "所有变更位于 allowed_paths"]
  }
}
