{
  "$schema": "../schema/spec-object.schema.json",
  "schema_version": 1,
  "kind": "story",
  "id": "ATC-REC-006",
  "version": "0.1.0",
  "status": "proposed",
  "target_release": "REL-R1-RECEIVING-PILOT@0.1.0",
  "epic_id": "EP-RECEIVING",
  "feature_id": "FEAT-REC-RELEASE",
  "title": "受控解除隔离并发布执行资格",
  "summary": "将匹配身份、开放异常、条件限制和授权决定汇总为版本固定的放行决定，并以幂等事件通知下游。",
  "owners": ["收样产品负责人", "质量负责人", "实验室运营负责人", "QA负责人"],
  "source_refs": [
    {"document": "PRD-MAIN", "item": "OD-002"},
    {"document": "PRD-MAIN", "item": "OPS-RECEIPT-003"},
    {"document": "PRD-MAIN", "item": "OPS-IDENTITY-003"},
    {"document": "PRD-MAIN", "item": "RULE-026"}
  ],
  "depends_on": [
    "ATC-REC-003@0.1.0",
    "OD-002@1.0.0",
    "ATC-REC-004@0.1.0",
    "ATC-REC-005@0.1.0",
    "OPS-RECEIPT-003@0.1.0",
    "OPS-IDENTITY-003@0.1.0",
    "RULE-004@0.1.0",
    "RULE-026@0.1.0",
    "NFR-ARCH-002@0.1.0",
    "OD-005@0.1.0"
  ],
  "affects": ["receiving", "identity", "exception", "outbox", "lab-execution", "audit", "automated-test"],
  "change_class": "major",
  "body": {
    "readiness": "blocked",
    "business_outcome": "只有身份、异常和限制均满足批准规则的实物才获得明确执行资格；在制下游工作固定引用该资格版本，后续变化通过撤销或新决定传播。",
    "actor": "具备收样放行能力授权的身份评估员或质量批准人",
    "preconditions": ["ATC-REC-003 至 005 已交付", "OD-005 明确谁可放行及条件接收限制", "对象身份结论为允许类型", "所有阻断异常已有允许放行的决定或已关闭", "发件箱和幂等消费者可用"],
    "trigger": "授权人员在实物详情提交解除隔离或受限放行",
    "happy_path": ["重新读取并锁定对象、身份结论、异常和限制的最新明确版本", "计算 RELEASED 或 RELEASED_WITH_CONSTRAINTS", "创建不可变 ReleaseDecision", "条件更新 ReceivedItem 状态和版本", "同一事务写入 outbox 事件", "下游投影幂等更新执行资格", "任务创建固定引用 ReleaseDecision 版本"],
    "failure_paths": ["身份待定或错配无授权决定时拒绝", "存在开放阻断异常时拒绝", "适用性或限制解释为 UNKNOWN 时拒绝", "对象版本变化时返回冲突并重新评估", "发件箱写入失败时整体回滚", "消费者重复投递不得重复创建下游动作"],
    "invariants": ["放行决定不可变且引用所有输入版本", "状态变化不删除隔离历史", "在制任务绑定 releaseDecisionId/version", "规则更新不自动改变既有决定", "撤销通过新事件和影响评估而非覆盖"],
    "data_contract": {"releaseDecision": ["receivedItemId", "itemVersion", "identityDecisionVersion", "exceptionDecisionVersions", "ruleSetVersion", "outcome", "constraints", "approvedBy", "approvedAt"], "outcomeEnum": ["RELEASED", "RELEASED_WITH_CONSTRAINTS"], "event": ["eventId", "aggregateId", "aggregateVersion", "releaseDecisionId", "outcome", "constraintSummary", "occurredAt"]},
    "api_contract": {"operation": "POST /api/v1/received-items/{id}/release-decisions", "success": "200 ReleaseDecisionResult", "errors": ["IDENTITY_NOT_RESOLVED", "BLOCKING_EXCEPTION_OPEN", "RELEASE_APPLICABILITY_UNKNOWN", "RELEASE_NOT_AUTHORIZED", "EXPECTED_VERSION_CONFLICT"]},
    "state_transitions": ["IDENTITY_ASSESSING或QUARANTINED -> ACCEPTED", "满足批准限制时 -> CONDITIONALLY_ACCEPTED", "放行失败保持原状态", "后续撤销不删除原决定并触发影响评估"],
    "permissions": ["按 OD-005 角色、对象、产品、实验室和有效期授权", "条件接收可能要求质量或EHS追加批准", "发起人和最终批准人按矩阵职责分离", "下游服务只消费最小资格事件"],
    "audit": ["记录放行尝试、输入版本、规则矩阵、批准链、结果和限制", "失败阻断记录原因", "事件发布和每次重放可追踪", "撤销或失效引用原决定而不覆盖"],
    "ui_states": ["放行页展示身份结论、全部开放异常和限制摘要", "任何 UNKNOWN 明确显示为阻断", "条件接收显示允许/禁止动作和有效期", "并发冲突要求刷新", "历史决定和撤销链只读可查"],
    "observability": ["指标 receipt_release_total 按结果和实验室聚合", "指标 receipt_release_blocked_total 按规则码聚合", "发件箱积压和消费者死信告警", "可通过 correlationId 串联决定、事件和下游资格投影"],
    "test_cases": [
      {"id": "TC-REC-006-01", "title": "正常放行", "type": "positive", "given": ["身份匹配", "无开放阻断异常", "授权有效"], "when": ["提交放行"], "then": ["创建ReleaseDecision", "状态变为ACCEPTED", "发布一次幂等事件"]},
      {"id": "TC-REC-006-02", "title": "受限放行", "type": "boundary", "given": ["OD-005允许条件接收", "限制完整且批准链满足"], "when": ["提交受限放行"], "then": ["状态为CONDITIONALLY_ACCEPTED", "事件携带限制摘要", "下游按动作再次校验"]},
      {"id": "TC-REC-006-03", "title": "开放异常", "type": "negative", "given": ["存在未决定的身份冲突异常"], "when": ["尝试放行"], "then": ["返回BLOCKING_EXCEPTION_OPEN", "状态和事件均不变"]},
      {"id": "TC-REC-006-04", "title": "越权放行", "type": "security", "given": ["用户无对应实验室或严重度授权"], "when": ["提交放行"], "then": ["服务端拒绝", "记录审计"]},
      {"id": "TC-REC-006-05", "title": "并发异常出现", "type": "concurrency", "given": ["预览时可放行", "提交前新增阻断异常"], "when": ["使用旧对象版本提交"], "then": ["版本冲突或条件写入失败", "不发布事件"]},
      {"id": "TC-REC-006-06", "title": "重复事件", "type": "recovery", "given": ["同一outbox事件投递两次"], "when": ["下游消费者处理"], "then": ["资格投影只生效一次", "处理记录可审计"]},
      {"id": "TC-REC-006-07", "title": "规则升级", "type": "regression", "given": ["对象已绑定旧ReleaseDecision", "新OD-005版本发布"], "when": ["读取在制任务资格"], "then": ["继续引用旧决定", "除非批准影响评估和迁移"]}
    ],
    "non_goals": ["不自动批准条件接收", "不自动创建检测任务", "不把新规则应用于既有决定", "不实现完整QMS偏差流程"],
    "allowed_paths": ["src/modules/receiving/release/**", "src/modules/receiving/public-contracts/**", "src/modules/lab-execution/eligibility-projection/**", "contracts/receiving/release/**", "apps/web/receiving/release/**", "tests/receiving/release/**"],
    "verification_commands": ["python -m tools.specgen check", "TECH_STACK_TEST_COMMAND_REQUIRED_BY_ED-001", "OUTBOX_IDEMPOTENCY_TEST_REQUIRED", "PINNED_BASELINE_REGRESSION_TEST_REQUIRED"],
    "definition_of_done": ["放行决定固定所有输入版本", "正常、受限、阻断、权限、并发、恢复和规则升级测试通过", "发件箱与消费者幂等", "在制对象不读取最新版", "撤销和影响评估边界有契约", "追踪矩阵完整"]
  }
}
